{
  "title_working": "Second Awakening",
  "premise": "F-rank porter Kang Do-yoon dies in the Seoul Collapse ten years from now and wakes on the morning of his awakening measurement at twenty-seven. He knows the Collapse's mastermind, \"the Watcher\", is Hunter Association Chairman Yoon Jae-kyung—and he cannot prove it. He builds power quietly to stop the Collapse, but the future starts to slip every time he intervenes.",
  "premise_language": "en",
  "genre": {
    "primary": "hunter-gate",
    "secondary": ["regression"],
    "notes": "Regression devices strong; romance as a slow-burn subplot."
  },
  "main_character": {
    "name": "Kang Do-yoon",
    "role": "protagonist, regressor",
    "description": "27. Spent ten years at the bottom as an F-rank porter before dying in the Collapse. Cold, terse. Uses future knowledge as a weapon but cannot prove any of it, so he always moves quietly.",
    "speech_notes": "Polite-neutral by default. Blunt with juniors. Fully formal with chairmen and Association executives."
  },
  "supporting_characters": [
    { "name": "Lee Seo-ha", "role": "female lead, healer", "description": "24, B-rank healer. Hides that she is a conglomerate chairman's illegitimate daughter.", "speech_notes": "Polite and precise with everyone; first names with Do-yoon only from ch.87." },
    { "name": "Park Mu-jin", "role": "mentor", "description": "45, C-rank veteran hunter. Died shielding Do-yoon in the previous life.", "speech_notes": "Gruff and informal downward; proverbs; calls Do-yoon 'son' when serious." },
    { "name": "Choi Hyun-seok", "role": "antagonist", "description": "31, A-rank, Vice-Guildmaster of White Night. Polished; never raises his voice." },
    { "name": "Han Yu-ri", "role": "comic relief", "description": "19, D-rank rookie. Misunderstands easily.", "speech_notes": "Eager and polite to seniors; slips into casual speech when excited." }
  ],
  "world_concept": "Modern Seoul decades after the gates opened. The Association measures awakened people on an F–S scale. No status windows—only measurement-device readings. Mana-stone economy.",
  "desired_tropes": ["regression", "overpowered growth", "hidden strength", "satisfaction beats", "mentor bond", "occasional forum interludes"],
  "forbidden_developments": [
    "Do-yoon telling anyone about the regression before ch.58",
    "Park Mu-jin dying in Season 1",
    "The Watcher's identity being revealed before ch.120",
    "Any confession or physical intimacy before ch.87",
    "Harem developments"
  ],
  "target_audience": { "rating": "15", "description": "Adult readers of English-language serialized fiction in the Korean webnovel tradition" },
  "tone": { "keywords": ["cold", "tense", "intermittent humor"], "humor_level": 2, "darkness_level": 3, "pace": "fast" },
  "romance": { "presence": "subplot", "pace": "slow_burn", "constraints": ["No confession before ch.87"] },
  "progression_system": "Association ranks F–S determined by measurement-device readings; growth through dungeon clears and mana-stone absorption. Do-yoon's edge is regression knowledge plus a late awakening, not precognition.",
  "ending_preference": "happy",
  "target_chapters": 180,
  "target_words_per_chapter": 2500,
  "spelling_locale": "en-US",
  "mandatory_scenes": [
    { "description": "Chapter 1 opens on the measurement device showing F.", "placement_hint": "ch.1" },
    { "description": "The Gangnam gate break happens differently from the original history.", "placement_hint": "around ch.20" },
    { "description": "Seo-ha learns about the regression.", "placement_hint": "ch.58" }
  ],
  "content_restrictions": ["Violence within a 15+ rating", "No sexual content"],
  "prose_preferences": ["Short sentences", "Exposition through action and dialogue", "Hindsight monologue at most 20% of a chapter"],
  "setting_preferences": { "setting_type": "modern_korea", "notes": "Real Seoul districts, romanized." },
  "naming_preferences": { "style": "korean_romanized", "romanization_system": "revised_romanization", "notes": "Family name first, hyphenated given names (Kang Do-yoon)." },
  "terminology_preferences": { "default_decision": "translate", "notes": "hunter, gate, awakened, mana stone; 'Senior' + surname instead of sunbae." },
  "operating_mode": "assisted",
  "quality_tier": "standard"
}
